{
  "$schema": "https://crossforge.dev/schemas/rpm-transaction.schema.json",
  "schema_version": 1,
  "kind": "rpm-transaction",
  "identity": {
    "name": "host-gcc-build-el8-x86_64",
    "role": "host-gcc-build",
    "distribution": "rocky",
    "release": "8.10",
    "baseline": "el8",
    "arch": "x86_64",
    "target_triple": null
  },
  "plan": {
    "file": "config/rpm/host-gcc-build-el8-x86_64.plan.json",
    "canonical_sha256": "cf9677a8a9ade26bf8dc131323f2432673cbeb8648b1c244b1784de9301aaf02"
  },
  "resolver": {
    "implementation": "python3-dnf",
    "contract_version": 1,
    "image": "quay.io/rockylinux/rockylinux:8",
    "image_digest": "sha256:e8a49c5403b687db05d4d67333fa45808fbe74f36e683cec7abb1f7d0f2338c6",
    "components": [
      {
        "name": "dnf",
        "nevra": "dnf-0:4.7.0-20.el8.noarch"
      },
      {
        "name": "libdnf",
        "nevra": "libdnf-0:0.63.0-19.el8.x86_64"
      },
      {
        "name": "librepo",
        "nevra": "librepo-0:1.14.2-5.el8.x86_64"
      },
      {
        "name": "libsolv",
        "nevra": "libsolv-0:0.7.20-6.el8.x86_64"
      },
      {
        "name": "python3-dnf",
        "nevra": "python3-dnf-0:4.7.0-20.el8.noarch"
      },
      {
        "name": "python3-rpm",
        "nevra": "python3-rpm-0:4.14.3-32.el8_10.x86_64"
      },
      {
        "name": "rpm",
        "nevra": "rpm-0:4.14.3-32.el8_10.x86_64"
      }
    ],
    "platform_python": "3.6.8",
    "load_system_repo": true,
    "plugins": false
  },
  "base": {
    "mode": "lock",
    "parent_lock": "locks/host-build-common-el8-x86_64.json",
    "parent_sha256": "d6d1b33772faa48658a30b01f5cc6a254c0b6c7640d52296b2e0f4efe7945c01"
  },
  "repositories": [
    {
      "id": "appstream",
      "baseurl": "https://download.rockylinux.org/pub/rocky/8.10/AppStream/x86_64/os/",
      "gpgcheck": true,
      "repo_gpgcheck": true,
      "gpg_key": {
        "sha256": "ef1ca99bba38bb2869a06fbf46860fcdaeece796be98f8dfb0160b84bdbc69ab",
        "fingerprint": "7051c470a929f454cebe37b715af5dac6d745a60"
      },
      "repomd": {
        "location": "repodata/repomd.xml",
        "sha256": "6d5fbe7420f306cf7c11ca052561852dc96c132ab647a366a5243f10cf6a5a3a",
        "size": 4923,
        "signature": {
          "location": "repodata/repomd.xml.asc",
          "sha256": "c7c68ede419450dd557f687c7a45fb282c973c921039ae03d796ddf1a5734df1",
          "size": 833,
          "fingerprint": "7051c470a929f454cebe37b715af5dac6d745a60"
        },
        "revision": "8.10"
      },
      "metadata": [
        {
          "type": "filelists",
          "location": "repodata/a3730d1adf271f960c8ea8be3c93802bc0b8b5aca48e9d07ecc9d303b47fc9b0-filelists.xml.gz",
          "checksum": {
            "algorithm": "sha256",
            "value": "a3730d1adf271f960c8ea8be3c93802bc0b8b5aca48e9d07ecc9d303b47fc9b0"
          },
          "size": 26652362,
          "open_checksum": {
            "algorithm": "sha256",
            "value": "cbcd7b6bed6be703b2105cfc420174c55b8c65953961b0b12887dae2c2a66131"
          },
          "open_size": 410780188
        },
        {
          "type": "filelists_db",
          "location": "repodata/5b8648495fa2672428653010fad8e0c4b872070d77d7aa43fd6d34e9d74d9edd-filelists.sqlite.xz",
          "checksum": {
            "algorithm": "sha256",
            "value": "5b8648495fa2672428653010fad8e0c4b872070d77d7aa43fd6d34e9d74d9edd"
          },
          "size": 11913544,
          "open_checksum": {
            "algorithm": "sha256",
            "value": "75619caab96550ce4f35c8d75e2e66516dbd4546f4f23fb49654bcdede03d235"
          },
          "open_size": 178798592
        },
        {
          "type": "group",
          "location": "repodata/ec2fa1982439f4b0ca7dc86f882f18657457a2d42f06ac6718298c7f7528df43-comps-AppStream.x86_64.xml",
          "checksum": {
            "algorithm": "sha256",
            "value": "ec2fa1982439f4b0ca7dc86f882f18657457a2d42f06ac6718298c7f7528df43"
          },
          "size": 486316,
          "open_checksum": null,
          "open_size": null
        },
        {
          "type": "group_xz",
          "location": "repodata/7ba43f88671d8107d6603ebff822fc071e73596a1e20779855af577b0e6e343a-comps-AppStream.x86_64.xml.xz",
          "checksum": {
            "algorithm": "sha256",
            "value": "7ba43f88671d8107d6603ebff822fc071e73596a1e20779855af577b0e6e343a"
          },
          "size": 81840,
          "open_checksum": {
            "algorithm": "sha256",
            "value": "ec2fa1982439f4b0ca7dc86f882f18657457a2d42f06ac6718298c7f7528df43"
          },
          "open_size": 486316
        },
        {
          "type": "modules",
          "location": "repodata/0c84e82887ef3e072db0a9bb3974c33f2061a1291569707caffdf587bf694fa2-modules.yaml.xz",
          "checksum": {
            "algorithm": "sha256",
            "value": "0c84e82887ef3e072db0a9bb3974c33f2061a1291569707caffdf587bf694fa2"
          },
          "size": 124416,
          "open_checksum": {
            "algorithm": "sha256",
            "value": "88464d3507e3e1d7940bdbe2a6c3370f5cb2a6874e13f39e716cfdb93117b023"
          },
          "open_size": 2531977
        },
        {
          "type": "other",
          "location": "repodata/ad9f87d44e6485f0a61a76340874a1385ee94831c1805a0fb25ddcbfea0f9754-other.xml.gz",
          "checksum": {
            "algorithm": "sha256",
            "value": "ad9f87d44e6485f0a61a76340874a1385ee94831c1805a0fb25ddcbfea0f9754"
          },
          "size": 2485725,
          "open_checksum": {
            "algorithm": "sha256",
            "value": "c5d5cff94f1144f7fd252c4440ab519245e6b9304f109a2e6a07de6ac4111759"
          },
          "open_size": 38892044
        },
        {
          "type": "other_db",
          "location": "repodata/181cd8cfddedd3d62af3d3a3029fbca15c6879c99a989e892238a01910e1cf17-other.sqlite.xz",
          "checksum": {
            "algorithm": "sha256",
            "value": "181cd8cfddedd3d62af3d3a3029fbca15c6879c99a989e892238a01910e1cf17"
          },
          "size": 2908024,
          "open_checksum": {
            "algorithm": "sha256",
            "value": "f8a322d0e053db5ca8c515efefab03e3237e2e322f6a4587d399f944c7962dad"
          },
          "open_size": 34549760
        },
        {
          "type": "primary",
          "location": "repodata/75c12624d56b3ce7a94e9c6109b20b0d5ebd9baa4e6de9d321b8b5f1926c7d87-primary.xml.gz",
          "checksum": {
            "algorithm": "sha256",
            "value": "75c12624d56b3ce7a94e9c6109b20b0d5ebd9baa4e6de9d321b8b5f1926c7d87"
          },
          "size": 3890252,
          "open_checksum": {
            "algorithm": "sha256",
            "value": "621a731162c1c23551e5ba8c3879a8e4a3947ad8026a43afc0b3ea236778b524"
          },
          "open_size": 52428738
        },
        {
          "type": "primary_db",
          "location": "repodata/d1177f2c1626397fe5f026547a05f6550b8ffeb81a2e778635001f2aaa24c207-primary.sqlite.xz",
          "checksum": {
            "algorithm": "sha256",
            "value": "d1177f2c1626397fe5f026547a05f6550b8ffeb81a2e778635001f2aaa24c207"
          },
          "size": 6793052,
          "open_checksum": {
            "algorithm": "sha256",
            "value": "102f100cf9327ade31d7695592a70b38e1a3acf710bfe5518660b01e0a89a185"
          },
          "open_size": 56823808
        },
        {
          "type": "updateinfo",
          "location": "repodata/fe1c0e21a63f59da5b8acaebf0549ff3adddba08c56867f389b1f54f560cd886-updateinfo.xml.gz",
          "checksum": {
            "algorithm": "sha256",
            "value": "fe1c0e21a63f59da5b8acaebf0549ff3adddba08c56867f389b1f54f560cd886"
          },
          "size": 3302536,
          "open_checksum": {
            "algorithm": "sha256",
            "value": "81d9cb78a55214262f9e7a7a8b50a533da84174aad1b68a521072763655516c3"
          },
          "open_size": 23123927
        }
      ]
    },
    {
      "id": "baseos",
      "baseurl": "https://download.rockylinux.org/pub/rocky/8.10/BaseOS/x86_64/os/",
      "gpgcheck": true,
      "repo_gpgcheck": true,
      "gpg_key": {
        "sha256": "ef1ca99bba38bb2869a06fbf46860fcdaeece796be98f8dfb0160b84bdbc69ab",
        "fingerprint": "7051c470a929f454cebe37b715af5dac6d745a60"
      },
      "repomd": {
        "location": "repodata/repomd.xml",
        "sha256": "3fe748acba64d7eda12ae5a319977ecc316fe7a4bd8e5990950cbfcf9e4c518c",
        "size": 4458,
        "signature": {
          "location": "repodata/repomd.xml.asc",
          "sha256": "7fbfd78037608fe1c3ebaa5bbfb0e2f95679b50ee7fd1a64e7602b11c4d28da6",
          "size": 833,
          "fingerprint": "7051c470a929f454cebe37b715af5dac6d745a60"
        },
        "revision": "8.10"
      },
      "metadata": [
        {
          "type": "filelists",
          "location": "repodata/5205dedd49181de6f70c503ce779a281d3a1918c818e6c893ae64a6755b9f714-filelists.xml.gz",
          "checksum": {
            "algorithm": "sha256",
            "value": "5205dedd49181de6f70c503ce779a281d3a1918c818e6c893ae64a6755b9f714"
          },
          "size": 31175641,
          "open_checksum": {
            "algorithm": "sha256",
            "value": "82ba8fbd0c7d9bb00cb820500e4cb89daeb073970deab6dbaf215e456b46743c"
          },
          "open_size": 498515456
        },
        {
          "type": "filelists_db",
          "location": "repodata/18fd6107dbd2f291161e2d01f7d847a6ca12b78f1b17cea07ecfb3d7e4f38db2-filelists.sqlite.xz",
          "checksum": {
            "algorithm": "sha256",
            "value": "18fd6107dbd2f291161e2d01f7d847a6ca12b78f1b17cea07ecfb3d7e4f38db2"
          },
          "size": 20208580,
          "open_checksum": {
            "algorithm": "sha256",
            "value": "73e80edab5c7b2c1c39164980ce7ca930b4d695a3a9ad3f08241270f30e1dee9"
          },
          "open_size": 264323072
        },
        {
          "type": "group",